lineText,sessionId,y_pred,y_prob_max,y_true
i just moved to a new house and id like to open an account with bg,INT-sv1appin05-1452932130329-209223,Account Management,0.224993970857,Account Management
  trying to set up a recurring payment  have done so in the past  cant make it happen today for some reason,ID1105494714,Billing & Payments,0.91438197745,Billing & Payments
 im trying to make a principe payment on my heloc online,INT-va1appin10-1437137036284-20648,Billing & Payments,0.888791967145,Billing & Payments
how do i setup that my accounts guard each other for overdraft protection,INT-va1appin05-1437741578134-65029,Fees and charges,0.163661994761,Account Management
 i no longer buy my energy from british gas but have a homecare agreement how do i register to make engineers appointments online,INT-sv1appin09-1451915517606-103591,Account Management,-0.268966625012,Scheduling Appointments
 i have been with british gas for nearly two years now and have not had my boiler serviced yet i would like to arrange for ts to be done also a wle back i received a call from british gas regarding insulation in the roof i just wondered if you could tell me more about that,INT-sv1appin06-1453208519208-233600,Product or Service Quality issues,-0.520773749379,Product or Service Quality issues
listen i want to set up a payment to an account,ID1149181477,Billing & Payments,1.41253715232,Billing & Payments
i have homecare 100 how much is the homelcare 200,INT-sv1appin06-1453030136741-216333,Purchase Pricing Enquiry,0.53417589187,Purchase Pricing Enquiry
is there anytng written on the check as a memo,ID1142148559,Disputes,-0.576467436473,Billing & Payments
  _end_ im looking to cancel my homecare agreement  _end_ as we have moved out of our house ,INT-va1appin10-1453292305347-3672,"Modifications, Cancellation and Refunds",0.490788285532,"Modifications, Cancellation and Refunds"
my phone line is not uverse i have been unable to get the registration code,ID1020419718,Product or Service Quality issues,1.19228512943,Product or Service Quality issues
 i disputed a charge of 9786 from norton today because i couldnt get in touch with them but i did and t promise to refund the charge so id like to retract the dispute,INT-sv1appin05-1438261352446-96486,Disputes,0.600032616604,Disputes
i just wanted to check that you cover my type of boiler,INT-sv1appin06-1453217203711-234669,Purchase Pricing Enquiry,0.379072258276,Purchase Pricing Enquiry
why has the deposit of 3000 taking so long to clear it was withdrawn from my account since thursday october 9 my name is karen alexander,ID1208625116,Fees and charges,0.0284228058034,Billing & Payments
"i ordered some items on targetcom to be spped to huntsville al target store some are ready to be picked up but others are not it says i have 4 days to pick up my items i want to pick them up all together because i live 45 min away can i wait until all my items have made it to the store to pick them up at the same time order  xxxx-xxxx-4708 e-mail is xxxxxxx ""also i would like to edit my order by canceling the ottoman is that possible as well"" sure no problemn ""yes cancel the ottoman please so when would be the last day i could pick up the items that are already there""",INT-va1appin08-1445089288364-42955,Shipping  & Order Status,0.488049695452,Shipping  & Order Status
" i placed2 offers ts am and need to cancel one as i ordered the wrong ottoman ""sorry 2 online orders"" yes ""ok so when the ottoman comes in can i just return it to a local store"" ""ok thanks"" ""no but have a good day""",INT-sv1appin05-1445194626420-897,"Modifications, Cancellation and Refunds",-0.0420378407781,"Modifications, Cancellation and Refunds"
can you please give me a call on 07913-994846 i am looking for a boiler cover in a but to let flat i purchased in watford,INT-sv1appin08-1453143477699-227196,Purchase Pricing Enquiry,0.764202699826,Purchase Pricing Enquiry
i would like to know what are the peak hours costs for electricity in my area,INT-sv1appin07-1453198769737-232851,Purchase Pricing Enquiry,0.674442006037,Billing & Payments
ive got a homecare plan and just wanted to check if it covers pipes and plumbing etc,INT-sv1appin06-1453200466410-232985,Purchase Pricing Enquiry,-0.287288358573,Purchase Pricing Enquiry
 i created a payment today confirmation   jgqtr-568z3 and need to add a case  to the check that will be sent to payee ron hof  is ts possible to add if the payment is processing,INT-va1appin09-1437437848400-39760,Billing & Payments,0.590937980072,Billing & Payments
we dont actually repair or look after storage heaters so we wont be able to help get those repairs - sorry about that it is only gas systems that we cover ,INT-sv1appin05-1453107844975-223632,Scheduling Appointments,-0.0866531459057,Scheduling Appointments
can u tell me is ts 2797995 mattress comes with any base or not,INT-va1appin07-1437466595935-41809,Product or Service Details,0.340727347909,Product or Service Details
 have recently received a letter from you regarding nectar points i havent asscoaited my email with my account beforewhat do i need to  _end_ how do i do it on line - i cant remember my account  _end_ meyer 22 langborough rd wokingham r40 2bt 26828,INT-sv1appin07-1450802096117-41650,"Discounts, Offers, Promotions",0.810782108146,"Discounts, Offers, Promotions"
  _end_ im looking at the landlord pro but wanted more information regarding the excess  _end_ will i be charged ts for any call out including for the servise and gas certificate ,INT-va1appin05-1453288782238-4257,Purchase Pricing Enquiry,0.954375320312,Purchase Pricing Enquiry
 i would like to invest a part of my balance in fixed deposit how do i do that and what would be the interest and can i close it whenever i want to,ID1208394306,Billing & Payments,-0.0545957995461,Account Management
ok sounds just showing up late thats ok one other question - can you provide details as to how i can avoid the 14 month service charge,ID1207543702,Fees and charges,0.268284638561,Account Management
i have just checked my online banking and noticed that there is a 30 monthly service charge being debited from my account  i am quite disappointed with ts because at the time of opening i specifically asked at the branch in new york where i opened the account if there were any charges associated with the account - if there was then i would not have opened the account i also asked if there was any minimum balance required to maintain the account and again i was told no as i was a citigold customer in th euae,ID1148277489,Fees and charges,0.924468846719,Fees and charges
1 i moved to sao paulo over a year ago but i have not been able to change my address in my account 2 probably related 2 i found that my bank card atm card was re-issued without notice and the card that i have no longer works in atm,ID1206985374,Account Management,0.62145851567,Account Management
how do i cancel my  _end_ yes  _end_ norman brudney ,INT-va1appin10-1453906455317-65084,"Modifications, Cancellation and Refunds",1.0872021455,"Modifications, Cancellation and Refunds"
a family member has a broken boiler and i understand there are a few options,INT-sv1appin09-1453140711499-226812,Product or Service Quality issues,0.331942960998,Product or Service Quality issues
how do i change the amount of a one time payment,ID1103158464,Billing & Payments,0.413517455931,Billing & Payments
ll i need to know is what my direct debit is going to be it is an annual service pound80 but then you didnt seem to be able to pay for that as a one off fee i then selected a monthly payment to come out on the 1st of every month but it didnt say what ts would be is it simply pound80  12,INT-sv1appin06-1453209931664-233733,Billing & Payments,0.155843399582,Product or Service Quality issues
 i need to switch the power at my house into my name,INT-sv1appin06-1453059151368-218710,Scheduling Appointments,0.148976149423,Account Management
 ive tried several times to cancel an 827 payment to butterbeans but my account hasnt been credited,ID1204458697,"Modifications, Cancellation and Refunds",-0.09922209841,Billing & Payments
i see i see a deduction on my account i dont know about,ID1145816416,Fraud,-0.293036843479,Fees and charges
can you please wave the 1000 fee  my account is overdrawn and i cant afford to balance it out right now,ID1095727319,Fees and charges,1.0304989549,Fees and charges
 i was looking for my rewards program balance,INT-va1appin05-1437579713514-51337,"Discounts, Offers, Promotions",-0.0670638635242,"Discounts, Offers, Promotions"
im wondering if you help me with an essuit  i been haven  on my account i have a charge wch i disputed because i never got ts order and right now its shoing again on my account,INT-sv1appin09-1438303659651-99832,Disputes,0.0949255965722,Disputes
i am showing that a payment was scheduled to be made onxxxxxxxx in my email and i tnk that payment was cancelled and i just made a payment today are you showing in your records a payment being made onxxxxxxxx-15,INT-sv1appin10-1438101343880-84381,Billing & Payments,0.87897828611,Billing & Payments
pllip foster want to close account ending in 7239,INT-sv1appin09-1438100079761-84222,Account Management,0.591738362171,Account Management
i just wanted to see about ordering a new card with a different image on it and im not sure where to go to do that,ID616939828,Warranty & Repairs,0.573984673148,Warranty & Repairs
 we have homecare cover for service of boiler and gas fire  not sure if it covers repairs ,INT-sv1appin10-1453109701181-223744,Product or Service Quality issues,0.848671306166,Product or Service Quality issues
 have received a pound12 energy credit voucher however my name has been spelt incorrectly therefore i cannot collect it,INT-va1appin09-1452765469888-889,"Discounts, Offers, Promotions",0.695608046672,"Discounts, Offers, Promotions"
 i have a mains 24he combi boiler and the 2a fuse keeps blowing an you send out today an experience d boiler engineer please,INT-sv1appin06-1453207631736-233528,Product or Service Quality issues,0.0957645592326,Scheduling Appointments
 amit im trying to find a better deal on my gas and electric can you please help  me,INT-sv1appin09-1453107126386-223586,Account Management,0.0530973058261,"Discounts, Offers, Promotions"
 thomas i accidentally scheduled a wrong transfer and would like to cancel it,INT-va1appin08-1437160250101-23004,Billing & Payments,0.138735193189,Account Management
  tried to book a break down but doesnt seem to work for me just freezes on a wte screen,INT-sv1appin06-1453043500642-217111,Scheduling Appointments,-0.397087029439,Scheduling Appointments
 arjun we recently moved into our property supplied by british gas we changed the account over to our name and now weve switched provider just need to query our final bill as its much gher than it ,INT-sv1appin10-1452707174853-188652,"Modifications, Cancellation and Refunds",-0.0539367915101,Disputes
"i placed an order on 106 and as of ts morning i checked tracking for an item and it says it has been cancelled by the spper xxxx-xxxx-0109 xxxxxxx thank you ""no the boots size 11 had a tracking  and as of ts morning it says it was cancelled by spper but i have not received email refund or items"" ts is the tracking  target sent 1zy8f934ywxxxx-xxxx-60",INT-sv1appin09-1445194296290-886,"Modifications, Cancellation and Refunds",0.484441982021,Shipping  & Order Status
i have direct deposite coming from randstad is my account frozen  becuase its showinng negative for over month and the next question is im going to chargeanytng else because i was without a job my last four i ssn is 6835,ID1187332815,Account Management,-0.286051860056,Account Management
yes i would like to know why i keep gettng charged mthly svc,ID1096319063,Fees and charges,-0.430652481838,Fees and charges
  mckenzie i called capital one about a problem logging into or creating a rewards checking account i received a confirmation number 188725 and was told the problem should be resolved witn a couple of days and after over a week my account still doesnt work id like to redeem my points before my account changes,INT-sv1appin10-1438290815044-98935,"Discounts, Offers, Promotions",0.292420489067,Account Management
do u have a recommend a friend program  _end_ i was telling someone about the appliance cover and wondered if theres a link i can send them _end_ no i am not going to call them for ts ,INT-va1appin08-1453375316215-7310,Complaints,-0.279992260681,Complaints
how do i view and cash in points i have done in the past but cannot remember how,INT-va1appin06-1437166814606-23655,"Discounts, Offers, Promotions",1.08647238697,Account Management
 im jessica carrilloi need to dispute a transaction on my mastercard debit card,INT-va1appin07-1437239518591-27122,Disputes,0.622010824373,Disputes
what are these transactions on my savings who approvedprocessed how and why my information has not been stolen citibank did ts and the person on the phone could not explain it to me he put me on hold forever we got disconnected no call back,ID1188199295,Billing & Payments,-0.176584266656,Fraud
i would like to a person by phone re a payment wch has been incorrectly reversed by citibank,ID1202266368,Billing & Payments,-0.0832800090135,"Modifications, Cancellation and Refunds"
i want to redeem my rewards checking rewards,INT-va1appin06-1437479722257-42403,"Discounts, Offers, Promotions",1.71886736407,"Discounts, Offers, Promotions"
 i changed my gas and electric supply to you a few weeks ago my electric has changed but not my gas,INT-sv1appin05-1452884953166-205089,Account Management,-0.162489654836,"Modifications, Cancellation and Refunds"
please ring me michael 01423 871987 re an order,INT-va1appin07-1437414206073-36934,"Modifications, Cancellation and Refunds",-0.126992405221,Ordering Process
 i just wanted to ask about a payment check payment i made that the payee never received the payment would have been mailed to them but t never got it i would like to stop payment on that as i subseuqently sent another payment the reference number is 10506 the amount was 139 and the payee was thomas pfundstein,ID1191543140,Billing & Payments,2.46515095312,Billing & Payments
i would like to book an engineer,INT-sv1appin09-1453211433374-233880,Scheduling Appointments,0.804501782633,Scheduling Appointments
will i get 10 off on canon 700d,INT-va1appin07-1437986769893-76489,"Discounts, Offers, Promotions",-0.216692156986,"Discounts, Offers, Promotions"
not sure why my order wont go through,INT-va1appin09-1445097854093-22463,Shipping  & Order Status,-0.293834562885,Shipping  & Order Status
i need to change the address on ts account please,INT-va1appin06-1437747979569-65563,Account Management,1.54135548027,Account Management
if i sign up to your home and boiler cover tier 3 at pound1525 per motnh can i claim the annual boiler service now from the outset  we have a pressure drop problem on our boiler right now but also would like cover going forward  i am keen to buy online to get the discounts applied,INT-sv1appin10-1453195809828-232669,Product or Service Quality issues,0.638548474036,"Discounts, Offers, Promotions"
i did a chat last week regarding a bill pay that was never received by the person i was trying to pay reference 10352 the person on chat said t would credit it back to my account i did not see the 360 post yet any idea why not,ID1146894196,Billing & Payments,0.914393149523,"Modifications, Cancellation and Refunds"
i wanted to talk to about some recent transactions in my bank account there was a decrease of 433447 from my bank account,ID1095945594,Fraud,-0.466925161884,Fraud
i would like to transfer usd from my account in poland to my account in new york will there be any fee on the receiving end in new york,ID1149055695,Account Management,0.136607955158,Fees and charges
id like to transfer my rewards balance to my venture card,INT-sv1appin09-1438107670714-85135,"Discounts, Offers, Promotions",-0.390286038703,"Discounts, Offers, Promotions"
 i am not able to change the address from account managment could you please do that on my behalf i get an error message,ID1186245113,Account Management,1.17162039697,Account Management
 i had a one off repair on my boiler completed by your company in may and the same issue has come back i believe the work is guaranteed for 12 months is ts correct,INT-sv1appin09-1453210020178-233734,Scheduling Appointments,-0.203193741453,Product or Service Quality issues
i am trying to close my capital one bank accounts,INT-va1appin08-1437668028247-58941,Account Management,1.12312634342,"Discounts, Offers, Promotions"
theres a pending charge in my account that i dont know wheres coming from,INT-va1appin05-1437574103628-50652,Fraud,-0.266681273717,Disputes
loan ending in 0281 ready credit payment was sent as an online payment from citibank checking on monday september 1st however did not post until two weeks later on friday september 12th causing a 10 late charge  i have never been late on payments  i am disappointed that on online payment from citibank to citibank took 12 days to post wch caused a 10 late fee  i have deleted my autopay monthly payment and have setup a recurring online monthly transfer beteen accounts instead  my request is to credit the 10 late charge on ts account,ID1191646681,Billing & Payments,0.55297556905,Fees and charges
can you tell me if there are grants available to people aged over 60 who are in receipt of working tax credits,INT-sv1appin09-1452106282409-124266,Product or Service Details,-0.511683454927,"Discounts, Offers, Promotions"
im trying to register online for an account and having trouble,INT-sv1appin05-1452960625026-211006,Account Management,1.26681562562,Account Management
need to book a service,INT-sv1appin08-1452608556411-176379,Scheduling Appointments,0.255482824568,Scheduling Appointments
would you please close my savings account,INT-va1appin06-1437666033578-58701,Account Management,0.901172575181,Account Management
" kevin i am trying to purchase a item for a wedding and when i proceed to checkout it is giving me a null error loginformaction of null ""no siri do not have one my nephew is getting married and i was looking at the online registryadded the item to my cart and went to checkout it did not ask me to log in do i need to create a account"" ""okay i will try that i did close the target website and re-logged in but it did it again"" thank you and if it does not work and can try again in the morning",INT-va1appin08-1445056862315-41618,Website Issue,-0.274335734704,Website Issue
i do not know how to get messages off phone,ID1019458897,Product or Service Quality issues,1.00588225188,Product or Service Quality issues
i need to arrange a boiler check up for my mother i am going to pay for it on my card as my mother does not have a credit card  i have been told i cant do ts as my mum needs to be with me when i arrange it  we both have bg accounts  i am at work at the moment and my mum lives in bury and i live in blackburn bit of a distance,INT-sv1appin09-1453211051385-233838,Billing & Payments,-0.404837262165,Product or Service Quality issues
i have a gas meter on an external wall  i had an engineer visit to swap out the type of meter but it needs a cover put on it,INT-sv1appin06-1452940966663-209592,Purchase Pricing Enquiry,0.175327834084,Purchase Pricing Enquiry
 i need help my cat g boiler does not ignight,INT-sv1appin09-1453031328536-216382,Product or Service Quality issues,0.205651422354,Product or Service Quality issues
 can the tabitha fabric sofa bed be brought in any colour as i am looking for a green sofa bed but do not like the ones on offer,INT-va1appin08-1437730838200-64507,Product or Service Details,0.856363086728,Product or Service Details
i made one transaction to bryan saenz of 950 a few days ago via popmoney 1900 dollars has been taken from my accoint and bryan has received notng can you let me know why it has gone out twice and why he has not received anytng,ID1100762312,Disputes,-0.0929805151899,"Modifications, Cancellation and Refunds"
i am looking for a wardrobe depth 55 height 200 width 150,INT-va1appin05-1438680845171-89467,Product or Service Details,0.479659481245,Product or Service Details
 i have noticed that ive had the same amount of reward points for a long time now i would like to know how i got them and why i stopped getting more please im doing well thank you for asking,ID1102370801,"Discounts, Offers, Promotions",-0.235932162404,"Discounts, Offers, Promotions"
i made a capital one credit card payment and it was processed today but as i checked on my credit card account the payment didnt apply yet,INT-sv1appin07-1436803898245-64059,Billing & Payments,0.2338496358,Billing & Payments
 my home phone has not been working since my uverse was installed,ID1019449526,Product or Service Quality issues,1.57708711819,Product or Service Quality issues
can you deliver to trecco bay caravan park,INT-va1appin05-1437394860833-34729,Product or Service Details,-0.113929452458,Shipping  & Order Status
 i am a citi premier credit card holder how can i tell how many points have,ID1202666690,"Discounts, Offers, Promotions",0.363186393908,"Discounts, Offers, Promotions"
i have am inquiry about my bill,INT-sv1appin06-1453232713591-237056,Fraud,-0.690019982299,Billing & Payments
why did the minimum due auto pay not kick in to avoid a late fee,ID596043885,Disputes,-0.306126231277,Disputes
can you check why my account has monthly service charges i were told if i have direct deposit there will be no monthly charges,ID1202790376,Fees and charges,0.64386104468,Fees and charges
i am sure we had an appontment today for smart meters to be unstalled but i have not heard from  _end_ thank ,INT-va1appin08-1453470681750-17953,Purchase Pricing Enquiry,1.21827962739,Purchase Pricing Enquiry
gm i see minimum interest charge being charged every month what is that,ID1095829814,Fees and charges,0.3400569214,Fees and charges
says for me confirm my pin so i do then it says theres a error,INT-va1appin05-1445021727954-37934,Account Management,-0.308421931898,Website Issue
so i found out from several people to whom i recently sent wire transfers from my main checking account ending 0806 that t were charged 15 for the incoming wire transfer all of them save for one are citibank clients too in some of these instances ts is the manner in wch i pay the persons salary none of them had any idea these fees would be imposed there used to be no fees charged for ts i just transferred a total of 275 to the 5 people who were several times t with these outrageous fees 90 each to two recipients 120 to another 60 to another and 15 to the non-citibank person i believe that citibank should reimburse me for these fees -- or refund them to the appropriate clients and then i will sort out evening up with each of them,ID1148842864,Fees and charges,0.983047200756,"Modifications, Cancellation and Refunds"
can you recommend a black microwave underpound50,INT-va1appin07-1437411792159-36627,Product or Service Details,0.205467343758,Product or Service Details
i am trying to set up a recurrent international wire transfer but i do not seem to be given that option in the screens i have i am trying to modify the amount to an existing recurrent internation wire transfer but i am not given that choice so i decided to initiate a new recurrent transfer with the new amount and cancel the older transfer unfortunately i cannot edit it so trying to set up a new recurrent international wire transfer seems not possible am i doing sometng wrong,ID1147377334,Fees and charges,-0.0886524355272,Billing & Payments
how do i obtain a capitol one card for my wife,ID644751928,Billing & Payments,-0.282743346736,Account Management
do you provide electricity to retail clients in london,INT-sv1appin07-1453217514443-234701,Purchase Pricing Enquiry,0.672696031721,Purchase Pricing Enquiry
my customer reference number is registered to occupier and i am unable to create an account because of ts ts will be my first paid bill since moving into the property,INT-sv1appin05-1453212255331-233968,Account Management,0.61647677114,Account Management
i am looking to switch my gas and electricity supplier but need a new boiler too was wondering if british gas had any deals currently for switcng,INT-sv1appin05-1452954963118-210425,Purchase Pricing Enquiry,0.58084329925,"Discounts, Offers, Promotions"
good because that bill is due lets hope sooner instead of later thanks,ID665214090,Shipping  & Order Status,-0.665567751572,Billing & Payments
we are expecting 2 wires please 2 for amount 10 000  so about 20 000 ,INT-va1appin07-1437656892507-57656,Fees and charges,-0.0145785502572,Billing & Payments
i was wondering how much the monthly payment would be if i transfer a balance of 4000,ID665075146,Billing & Payments,1.62016674418,Billing & Payments
if i order it will it be there by friday i live in colwyn bay,INT-va1appin06-1437395484558-34779,Shipping  & Order Status,-0.0186813451461,Product or Service Details
no thank you can i use my reward points towards a flight purchase i mean an airline ticket from jetblue aa or delta etc,ID1149797092,Warranty & Repairs,0.476139557385,"Discounts, Offers, Promotions"
i am online now - obviously - but the system says it is too late for me to change a payment that will go out later today  however i know in the past ive called in with ts timing and the agent has been able to help me i dont need information i need you to stop a bill payment that the system wont let me stop,ID1202253604,Billing & Payments,0.607037379294,Billing & Payments
ts company that has a crooket agreement t offered a free trial with a 495 dollars  charge i gave my debit card  --unfortunately-- without me asking them to send me a whole set of their product t waited 14 days and sent me the product for 11995 dollars t seem to be a scam  i need you to help me take them out from my credit card access,ID1189555718,Fees and charges,-0.449048507237,Fraud
