lineText,sessionId,y_pred,y_prob_max,y_true
 dodger i am upset about my citi bank account last month i was charged service fees for not having enough money in my account then i talked to someone who adivsed me to switch my checking account and said if i maintained 1500 i wouldnt be charged another fee and after switcng there is another fee on my account ts month ive been a citibank customer for over 7 years now and i am getting very annoyed by these charges and am considering switcng banks,ID1183803025,Fees and charges,1.38613453269,Fees and charges
 my gas and electric bill was supposed to come through every 15th however i have checked my online account and it doesnt say how much my bill is could you tell me how much is it and when i am expected to pay it,INT-sv1appin05-1452965801867-211599,Billing & Payments,-0.0448363661654,Billing & Payments
if smart meters use mobile phone technology who pays the line charges etc _end_   gd afternoon ok will try the link ,INT-va1appin06-1453723220848-50675,Purchase Pricing Enquiry,0.237309274761,Purchase Pricing Enquiry
 i was trying to view my credit card account ending in 4234 cant seem to find it,INT-sv1appin07-1438349916658-102188,Account Management,0.440922277616,Account Management
iam curious to know do i have the option on my cards if i cant pay my bill you guys will,ID665489304,Billing & Payments,0.387056941983,Warranty & Repairs
please just tell me how to close my bank account with citi i need that to be done as soon as possible,ID1184122406,Account Management,0.82104477663,Account Management
if i register for online account will i still get paper bills,INT-sv1appin08-1453216217525-234503,Account Management,0.613032575343,Account Management
there is no account it was fraudulently opened  i did not open any account therefore i do not have an account number  i should be able to contact the people who are involved with my id theft case  ts is ridiculous,ID1189987795,Account Management,0.745789521891,Fraud
the atm transaction posted on 908 for 30699 was not authorized or received  i spoke to fraud prevention earlier about ts transaction,ID1191104497,Disputes,0.289193876508,Fraud
 i am not a british gas customer but would i be able to book an appointment to have boiler serviced,INT-sv1appin05-1453205309383-233337,Scheduling Appointments,0.484711102625,Scheduling Appointments
"its not letting me and i just want to know if my capital one account has some sort of ""block"" to not accept payments",INT-sv1appin09-1438367665015-103715,Warranty & Repairs,-0.0116350704986,Account Management
and the price will go back to normal when it is renewed next year,INT-va1appin07-1453895766985-60925,Purchase Pricing Enquiry,0.265150388489,Complaints
do you do gas fire servicing- and if so how much does it cost please,INT-sv1appin10-1453133810729-225832,Purchase Pricing Enquiry,0.147818415725,Purchase Pricing Enquiry
 sylvia  how do i change my password,ID1191120643,Account Management,1.17585205378,Account Management
 i just noticed i was charged 14 for a service charge i cant afford ts why did ts start and when,ID1143086100,Fees and charges,0.776509999972,Fees and charges
i understand that the 15 fee the other bank already made a fee for 27 wch is reflected on there side if i send 1200 i should see 1200 being deposited where i sent it to and then see additional fees right below it that being said i already confirmed with rbc and t deducted 27 and told me i should receive the full 1200,ID1189315951,Fees and charges,0.760106482657,Fees and charges
its quite old as is the house - 1800s build and id like to look into the price of a new boiler as the engineer said that the prices have come down quite a lot recently,INT-sv1appin05-1453210679674-233802,Purchase Pricing Enquiry,0.736093776259,Purchase Pricing Enquiry
in summary - t held my money for 4 months - and i lost 2615 on the transaction,ID1206957050,Disputes,-0.151109652444,Fraud
 our household gets both of our electric and gas from british gas and i was wondering if our boiler repair would be added to our bill or if wed pay for it separately,INT-sv1appin10-1452253538516-141934,Product or Service Quality issues,-0.207255815418,Billing & Payments
my debit card was compromised and an unauthorized charge of 230 was made can i open a new account and close ts one just to be safe,ID1184494199,Account Management,0.157016197567,Fraud
my payment i am setting up on bill pay is due on or before the 1st  what date do i chose for pay date,ID1103456996,Billing & Payments,1.25589815734,Billing & Payments
wondering why my savings account is blocked,ID1207154111,Account Management,0.206005712531,Account Management
good morning i  see deduction of 20 dollars  per month as  service charges  since almost  6 months i can not understand ts,ID1100621060,Fees and charges,0.914487030546,Fees and charges
i am interested in making loan payments from one of my account but i have a money market and a gh interest saving and your system says i can do it from either of these accounts is that correct,INT-va1appin07-1437754281209-66149,Billing & Payments,0.209289047739,Billing & Payments
first of all both my checking and savings accounts are joint account with my dad i was wondering if i could remove m from the account since he doesnt live in the us anymore he doesnt use the accounts anymore,ID1192136420,Account Management,1.07796547025,Account Management
 i am concerned about the charge on my account for 3002 from easyjet a company that i am not familiar with ,INT-va1appin09-1437505688497-45326,Disputes,9.01858998072e-05,Disputes
when i signed up to my new account to change my gas to a new tariff i thought i was entitled to  a amazon voucher also could you check that iam on the best tariff thanks,INT-va1appin09-1452774230689-1106,"Discounts, Offers, Promotions",0.530316223522,"Discounts, Offers, Promotions"
"i just placed an order but forgot to use a gift card should i quickly cancel and redo it or can you apply it ok it says t cannot cancel it at ts time  ""thats okay i will use it on sometgn else"" thanks",INT-va1appin08-1444970282723-32863,"Modifications, Cancellation and Refunds",-0.122564238905,Ordering Process
i would like to ask a question and change the payment option if i can,INT-sv1appin07-1453105322772-223465,Billing & Payments,0.777368267231,Billing & Payments
 i am nicole just a quick question about my debit card rewards as i hear it will be closed soon,INT-va1appin05-1437768775635-67329,"Discounts, Offers, Promotions",-0.176794245418,"Discounts, Offers, Promotions"
my new zip code should be 75861 but when i use my card it stills wants to use the old 75801,INT-va1appin09-1437154578958-22377,Account Management,-0.110610623856,Account Management
 my name is stacy and i am trying to figure out how to change the last name on my account i recently just got married and need to change it,ID660012263,Account Management,1.17027396249,Account Management
 ashley i just checked ts account that i rarely use and found that there is a 10 service charge every month can you help me determine what that is and if there is a cheaper way i can set up my account,ID1100985273,Fees and charges,0.738498611681,Fees and charges
2 tngs please  1 why cannot i still view my direct debit on the site and 2 whay have i have a bill for 1 months usage ,INT-sv1appin06-1453108913268-223698,Billing & Payments,0.436529126978,Billing & Payments
i need to change the policy number on my travelers auto insurance,INT-va1appin09-1438003775378-77430,Warranty & Repairs,0.105130894111,Billing & Payments
i would like to update my address on my account,INT-va1appin10-1437742854718-65124,Account Management,0.842497737504,Account Management
 will you be able to tell me why my account ending 582 is overdrawn,ID1143990052,Fees and charges,-0.129945371661,Fees and charges
im just wondering if its possible to use gift cards online,INT-va1appin05-1437592252470-52835,"Discounts, Offers, Promotions",-0.254213811538,"Discounts, Offers, Promotions"
the last two letters i recived went to my old address luckily i am having the mail redirected but could my new address be updated for any correspendce and bills,INT-sv1appin07-1453210573523-233781,Account Management,0.660448859114,Account Management
i am requesting a reversal of the 3000 service charge for the checking acct ennding in 5465,ID1099310156,Fees and charges,1.0691333911,"Modifications, Cancellation and Refunds"
 i have to go back to japan and could you change my address on my account,ID1184398039,Account Management,1.02178969963,Account Management
cant log in to redeem my award,INT-sv1appin08-1436896153939-69428,"Discounts, Offers, Promotions",0.48258250207,"Discounts, Offers, Promotions"
 i have a invoice i paid thru online billpay but the vendor has sent me an invoice claiming the account is still unpaid,INT-sv1appin06-1436808864138-64484,Account Management,0.0647432861822,Billing & Payments
"im having trouble applying the 10 discount code it says extra 10 with code decorate and i cant figure out where to type it in at ""yes its xxxx-xxxx-1281"" i do not see option i accidentally wrote the wrong code and now its gone oh i see it now",INT-sv1appin05-1445195674861-923,"Discounts, Offers, Promotions",0.804616261403,"Discounts, Offers, Promotions"
 i wanted to know how could i go about lowering my monthly payment,ID1186498930,Billing & Payments,1.05722485485,Billing & Payments
do i have to pay the  then cancel i dont have a job right now and cant pay for late fees and its over the limet of ,ID663206469,Billing & Payments,0.243676276479,Disputes
 ive just received a latest gas bill form email but i have already closed the account since i moved out about 6 months ago,INT-sv1appin10-1452616690217-177721,Account Management,0.151505152425,Billing & Payments
 i have just tried to ring the complaints number and it is saying that there are a gh number of calls i wish to make a complaint on here if  _end_ i have pre pay smart  _end_ ok well i have had notng but problems since t have been installed and i have called mulitple of times to complain ts morning i topped up my gas metre and i only wanted to put 5 on the metre so i tried to top up and it said that i couldnt top up at ts point please try again later so i put a different amount in the top up box and it let me top up sometimes thats all i have to put on it 5 it may sound stupid but its just ridiculous that i have to top up more than i want to and due to income changing im ,INT-va1appin09-1453375933364-3996,Complaints,-0.430141646949,Complaints
i would like to know why im being charged 20 everymonth from,ID1191901190,Fees and charges,0.366791644373,Fees and charges
 i am looking for landlord cover for  _end_ its only just out of warrenty and i have just had a gas cert done _end_ yes all good,INT-sv1appin10-1452536742096-167891,Purchase Pricing Enquiry,0.822146227337,Purchase Pricing Enquiry
i chatted with parker yesterday concerning card theft protection i cancelled ts in early feb and im still getting charged he gave me an  number wch i have been calling and all i get is a macne ,ID598046237,Fees and charges,-0.31372865952,Warranty & Repairs
  i am looking at my checking account online and there is a debit authorization that i do not know what is for  04-09-2014debit authorization apr09 1048p 4863at 2248 software 0019523922584 mn,ID1102246452,Account Management,-0.25060630202,Fraud
 my checking accoutn keeps transferring money to my citi thank you card - 100 dollars every month i cannot find the recurring transfer anywhere  my card has no balance so it keeps becoming -100 i want ts turned off but cannot do it myself,ID1148540070,Billing & Payments,0.464506558952,Fraud
"yep i also linked my citi credit card to it now i am confused about how to pay bills for that card if i click ""make a payment"" it brings me to ts page where i need an aba routing number and account number and etc",ID1146807886,Billing & Payments,1.0759339261,Billing & Payments
 i would like to pay quaterly gas bills how do i go about ts,INT-va1appin10-1452764162804-1102,Billing & Payments,0.474455271115,Billing & Payments
i just want to know how i can claim my nectar points without doing all of the other tngs on line i want to see paper coming from the ,INT-va1appin05-1453560102297-33700,"Discounts, Offers, Promotions",1.3929320362,"Discounts, Offers, Promotions"
i have an ongoing performance problem with my uverse internet your tech was out and replaced my gateway and sometng on the outside of our home i am still having intermittent problems i need a phone number to schedule someone to come out and replace the wiring wch is what the last tech said would be next if the problems continuewch t have what is the number for tech support to get a tech appointment,ID1019853345,Product or Service Quality issues,0.234369992215,Product or Service Quality issues
my boiler isnt working and its making a cracking sound,INT-sv1appin05-1452962442677-211217,Product or Service Quality issues,0.531066835466,Product or Service Quality issues
why is it every time i try to log on and see what my account looks like the web page says t are having a temporary delay,ID1208610865,Account Management,0.323475371306,Account Management
 im trying to get a credit refund but your site said its having issues,INT-sv1appin10-1452616352431-177660,"Modifications, Cancellation and Refunds",0.18854157924,"Modifications, Cancellation and Refunds"
the verona 4 seater patio garden set is not available for delivery for 11 days why is that,INT-va1appin10-1437391603455-34547,Product or Service Details,0.149104001095,Shipping  & Order Status
im trying to setup an online payment and dont have my checkbook what aba routing number should i use,INT-va1appin07-1437664480376-58517,Billing & Payments,1.01754874038,Billing & Payments
"i am trying to place an order and the system wont let me i put in 2 different valid card numbers to pay and it keeps telling me to enter a valid credit card number i did xxxx-xxxx-5500 xxxxxxx yes ""no sp to 177 grant ave nutley nj 07110 please"" ""7 llary terrace succasunna nj 07876xxxxxxxxxx""",INT-va1appin08-1445114199455-45693,Website Issue,-0.0913867178328,Ordering Process
 i am trying to enroll in the rewards points,ID1145729971,"Discounts, Offers, Promotions",1.00928097153,"Discounts, Offers, Promotions"
i  have moved home and i used british gas before and was looking for the best price,INT-sv1appin05-1453207980123-233552,Purchase Pricing Enquiry,0.366020101414,Purchase Pricing Enquiry
 my details on the bill are currently under occupier would i be able to change that on here or would i need to call the number,INT-sv1appin08-1451562183007-86791,Account Management,0.543048913004,Billing & Payments
i have ts week received my latest energy statement and after checking it i believer there is a pound50 dd electricity payment missing from it,INT-sv1appin07-1452880804346-204488,Billing & Payments,0.435968838442,Billing & Payments
i just need your payment address for paying my credit card,ID1104170228,Billing & Payments,0.123902756437,Billing & Payments
where can i find the foreign exchange rate for wire transfer,ID1206905562,Fees and charges,1.27913707571,Fees and charges
 - i am looking for a better deal for my ch cover wch is expiring soon i have seen that sse offer an equivalent 720 per month for their sheild gas heating care flexi wch is a like for like comparison - can you match that,INT-sv1appin08-1453208597234-233591,Billing & Payments,-0.596151295274,"Discounts, Offers, Promotions"
dear sir i have tried to see my account online i have gone my e mail addes amp my pass word moor the n ones,INT-sv1appin06-1453220739305-235213,Account Management,0.37831433212,Account Management
just a question i see a monthly service charge ts is new as far as i can tell,ID1097106585,Fees and charges,0.836546766384,Fees and charges
i am having problems signing into my account on line,INT-va1appin05-1437166047794-23589,Account Management,0.665153924272,Account Management
" kendall i need a help on ts ""when you spend 150 on baby items plus save on all graco"" from ts offer i can understand that if you spend 150 then a 25 gift card will be available to me yes sure",INT-sv1appin05-1445198015640-986,"Discounts, Offers, Promotions",0.322223505583,"Discounts, Offers, Promotions"
because right now t tok it from the other method of payment yesterday and from here too soo tomorrow my account is going to be overdrwan for more money thats why i request the stop i told you the reference number he gave me and he said dont worry notng is ging to happened amd loo how is my account now incredible,ID1098597530,Billing & Payments,0.382278025684,"Modifications, Cancellation and Refunds"
 there i called a few days ago regarding a 30 fee in my account good morning dennis and i was told that the 30 would be waived,ID1097193675,Fees and charges,1.61550926477,Fees and charges
 how i can get my reward point,INT-sv1appin06-1436794258929-63295,"Discounts, Offers, Promotions",1.57338187795,"Discounts, Offers, Promotions"
my account was debited twice for payment protectioni dont need it,ID660964867,Billing & Payments,0.584939423496,Disputes
i am already with homecare 910001808154 and have received my renewal that i am unhappy with on comparing on the internet i can get a similar service considerably cheaper _end_ mr m browett 7 wymersley close great houghton  northampton nn4 7 _end_ no as on looking on line i can get a similar cover to one i have now for a better ,INT-sv1appin09-1453224310012-235774,"Modifications, Cancellation and Refunds",-0.24161278136,Disputes
 iuve just done a meter reading and done it the wrong way round i have entered correct oine after but still showing wrong way round  xx,INT-sv1appin05-1451574700945-87538,Disputes,-0.166037919878,Purchase Pricing Enquiry
i want to close my checking acct,ID1203149884,Account Management,0.812735395435,Account Management
how do i pay my citi card account on line,ID1150615326,Billing & Payments,0.475125161828,Billing & Payments
i see that i was charges foreign transaction fees for 2 withdrawals i made from a citi atm in athens  why was i charged these fees  i have not been in europe in a number of years but i was never charged fees before,ID1208856440,Fees and charges,1.52586516805,Fees and charges
 how do i convert my reward points into cash,INT-va1appin08-1437515776343-46514,"Discounts, Offers, Promotions",0.920917492988,"Discounts, Offers, Promotions"
how much guarantee do i get ,INT-va1appin05-1437559966581-49645,Product or Service Details,0.438302622918,Product or Service Details
great how are you i would like to see how i can get waiver of ordering new checks,ID1099690350,Purchase Pricing Enquiry,0.127750294852,Fees and charges
i have a problem with my gas boiler under my homecare contract,INT-sv1appin06-1453032163917-216426,Purchase Pricing Enquiry,0.13854899062,Product or Service Quality issues
  i am trying to figure out if there are rewards points for ts accounti received a letter saying i need to redeem miles,INT-sv1appin05-1436743210922-60565,"Discounts, Offers, Promotions",1.76132608124,"Discounts, Offers, Promotions"
i would like to book an annual  _end_ yes received reminder to book a ,INT-sv1appin05-1452609326659-176507,Scheduling Appointments,0.886284128466,Scheduling Appointments
i was trying to book an appointment for the boiler offer you have at the moment but i noticed you dont have anytng available until late january and the offer ends monday will i still be eligible for the half price offer you have at the moment,INT-va1appin10-1452785264258-2198,"Discounts, Offers, Promotions",0.796907382408,"Discounts, Offers, Promotions"
can you please explain why you charge my account 100 dollars a month for maintenance,ID1202765576,Fees and charges,0.486974127313,Fees and charges
leo please advise on the teller withdrawal made to my account yesterday for 56707,ID1148915009,Account Management,0.0847831235818,Fraud
 my account 851004276209 is in credit and the direct debit has not been cancelled even though the account is inactive please can you cancel the direct debit and send the credit back to my account many thanks,INT-sv1appin10-1452932524402-209237,"Modifications, Cancellation and Refunds",0.169004553679,"Modifications, Cancellation and Refunds"
how can i make a note next to a bill to remind me it is paid automatically,INT-va1appin09-1437749756531-65734,Billing & Payments,0.175279570756,Billing & Payments
i need to book an engineer for the 1st feb 2016,INT-sv1appin07-1453047579230-217463,Scheduling Appointments,0.856428084114,Scheduling Appointments
i see aston sofa bed is out of stock when will it be back in,INT-va1appin10-1437393868064-34664,Product or Service Details,1.08582636432,Product or Service Details
im rhonda do you get rewards points on balance transfers,ID665156557,"Discounts, Offers, Promotions",0.613100043731,Warranty & Repairs
what is the minimum payment to start a citigold account,ID1145526969,Billing & Payments,1.056743091,Fees and charges
i cant create an account,INT-sv1appin06-1452523210665-165436,Account Management,0.957275576211,Account Management
can i cancel my debit card online,INT-va1appin09-1438019190520-78761,Account Management,0.671549979694,Account Management
i have a platinum account do i get miles if i transfer the balance to the venture account,ID663874384,"Discounts, Offers, Promotions",-0.270973607087,Warranty & Repairs
i want to set up on online account but my email is being used for my fathers account can i set up online with lesconnolly55gmailcom please,INT-sv1appin05-1452625434124-179311,Account Management,0.983603796419,Account Management
 need to acsess my new account ts has been going on for three weeks no one knows anytng,ID1097444292,Account Management,-0.100355723265,Account Management
 im looking to leave bg due to cost but need my mprn,INT-sv1appin10-1453047095065-217431,Purchase Pricing Enquiry,-0.12216864683,"Modifications, Cancellation and Refunds"
the first one is whether for my rent i can have it programmed online for citi bank to send a check for the amount from my account to the address of my landlord i was told by a friend that her bank does that for her,ID1191268312,Account Management,0.0300338320164,Billing & Payments
 there is the discount on the boiler only or your total cost,INT-sv1appin10-1452945298955-209785,"Discounts, Offers, Promotions",0.8511484352,"Discounts, Offers, Promotions"
how can i make deposits online with my citibank account i understand there is a way to upload cheques made out to you  can i do it here or on my ipad,ID1206101784,Account Management,0.604660123677,Billing & Payments
i see a debit for 4995 june 27th supremecleansekitcom  i did not make ts charge,ID1147060353,Disputes,0.0310835814944,Fraud
im looking through my checking account statement and theres a transaction i dont recognize on june 23 for 4995,ID1150710616,Disputes,-0.222478476528,Fraud
we moved to a new supplier recently and received our final bill from you wch came to 99p i normally pay online but when i try to pay the final bill it tells me that minimum online payment is pound2 can you tell ,INT-sv1appin09-1450863538573-46857,Billing & Payments,0.819271663128,Disputes
 not sure why i cant register to check accounts online,ID1204502496,Account Management,0.869711316736,Account Management
my fixed price tariff is due to end i pay pound27 per month for gas and pound9641 for electricity and greener energy boiler charge  the cheapest prices you quote me are pound4209 for gas and pound9417 for electricity and boiler  why am i suddenly having to pay so much more for gas,INT-sv1appin09-1453230023649-236633,Purchase Pricing Enquiry,0.430619307425,Disputes
what is the weight of ts wasng macne,INT-va1appin05-1437638118983-56386,Product or Service Details,0.0781254011933,Product or Service Details
" i used a promo code and then i had to cancel the order because it was spping to the wrong address is there any way to get that back it was 10 off an online order ""when i tried to type it in again it said that it was already used because i did use it on an order that i canceled"" ""okay thank you"" xxxx-xxxx-1912 and xxxxxxx ""yeah i got it in the store it printed out with a purchase i made as a store coupon"" ""that would be great it was my fault i forgot the default address on my phone wasnt mine""",INT-va1appin09-1445093802813-22008,"Modifications, Cancellation and Refunds",0.491297956097,"Modifications, Cancellation and Refunds"
 two tngs 1 when i log into the website it tells me i have another account available for linking what account is it talking about and 2 i spoke to someone earlier about converting my credit card to a product without an annual feeshe was going to refund the annual fee i have already paid but i dont see that transaction online yet,ID1191089178,Account Management,-0.210665446815,"Modifications, Cancellation and Refunds"
 luke ts is alicia mysiorski  i notice that i was charged an interest fee after i paid my account in full  i dont understand why,ID614321708,Fees and charges,0.153484254877,Disputes
 i need my home electrics looking at because we are a dual fuel customer with you can i get an engineer to come and look at ts,INT-sv1appin06-1452962105472-211184,Scheduling Appointments,-0.453101941348,Scheduling Appointments
 there im looking for an annual cost on the landlord boiler repair and cover  for 42 boilers at our private let development can you help,INT-sv1appin08-1453128022220-225078,Purchase Pricing Enquiry,0.417546390897,Purchase Pricing Enquiry
 there are two atm with drawls posted to my account on 76  i made that with drawl but only once not twice  there should only be one 40 atm transaction that day,INT-sv1appin07-1436873025244-67991,Fees and charges,-0.115670249428,Disputes
i am trying to book on line my homecare annual  service but it wont accept my booking code,INT-va1appin07-1452783689121-1592,Scheduling Appointments,0.072148574756,Scheduling Appointments
