lineText,sessionId,y_pred,y_prob_max,y_true
if i order when will it be delivered by,INT-va1appin06-1437411045931-36541,Shipping  & Order Status,0.867894656694,Shipping  & Order Status
im just contacting you to find out if my debit card covers me on car rental,ID1208274467,Warranty & Repairs,-0.131368633246,Billing & Payments
how much are fees,ID665035923,Fees and charges,0.195827678905,Billing & Payments
 barney im trying to update my address and its not letting me,ID1186309282,Account Management,0.804730917622,Account Management
i mean do you charge fees to have a non interest checking account,ID1148296775,Fees and charges,0.954079534794,Fees and charges
i am trying to close my savings account and cant find how to do ts,INT-sv1appin05-1438093479758-83485,Account Management,0.793024774054,Account Management
i have a question about a transaction debit purchase sep 02 0909 9074payblenheim 866-289-5 i did not authorize that transaction,ID1186892450,Disputes,-0.118902404161,Fraud
 i still do not have an account the tng is that i recently moved and i want to register,INT-sv1appin05-1452076385708-120587,Account Management,0.648497816407,Account Management
i would like to find out when i will receive my 40000 thank you points,ID1191698883,"Discounts, Offers, Promotions",1.13647251075,"Discounts, Offers, Promotions"
i cant find my reward points balance,INT-va1appin07-1437705714279-62803,"Discounts, Offers, Promotions",0.531108626842,"Discounts, Offers, Promotions"
 paula can you tell me when my balance will be updated  i was wondering if i can transfer back into my checking account,ID664306670,Billing & Payments,0.390720477282,Billing & Payments
i want to book my annual boilergas service  best julian,INT-sv1appin10-1453205359485-233343,Scheduling Appointments,0.172738587126,Purchase Pricing Enquiry
 pierre i see 2 charges on my most recent statement that i dont understand on 82514 and 82614 322 went to att automatically i was just chatting with att and t say t didnt charge me then can you figure out what happened,ID1191105120,Disputes,0.163321594667,Fraud
i am trying dispute a charge,INT-va1appin09-1437060993123-15114,Disputes,0.867765938651,Disputes
 i want to buy the oo door low sideboard later ts evening theres a 15 off voucher on it,INT-va1appin05-1437421659618-37973,"Discounts, Offers, Promotions",0.709441356364,"Discounts, Offers, Promotions"
i saw it on tv with the special offer of 10 off to pound179 then i go to internet to the same sale and indicates to use code floor10 however when i get into the dyson it shows pound199 and no place to include the code last week i saw the same model at pound209,INT-va1appin07-1437565946032-49934,"Discounts, Offers, Promotions",0.0578926621769,"Discounts, Offers, Promotions"
 pierre  i am wanting to make sure that my account ending 7624 is closed  im showing a zero balance but i want to make sure its actually officially closed,ID1206974095,Account Management,0.102076250846,Account Management
 i would like to pay  _end_ i am trying to pay online but for some reason it is not working _end_ it does not accept my ,INT-sv1appin07-1452020868783-115344,Billing & Payments,1.37860386704,Billing & Payments
 florence id like to place a stop payment on a check please,ID1188745474,Billing & Payments,0.979273972991,Billing & Payments
 samantha i need to check on the status of a payment the payment was made yesterday by phone by my friend from s checking account i have to make aboslutley sure ts payment will be processed before tuesday september 9th i do not see it on my account activity yet can you please help me,ID1186450530,Billing & Payments,0.684092492345,Billing & Payments
please can you give me a quote for boiler cover - conventional boiler - potterton 10 years old,INT-sv1appin07-1453032644861-216428,Purchase Pricing Enquiry,0.748801079382,Purchase Pricing Enquiry
 there just need a note that i am planning on making a couple payments for the past due on ts friday and next fridayim brittani simmons,ID671327039,Billing & Payments,0.261450962679,Billing & Payments
i tried to pay for airline tickets online last night but the payment was declined by the bank,INT-va1appin06-1438002829317-77351,Billing & Payments,1.52228578596,Billing & Payments
i am looking to purchase a boiler service but online it wants me to sign up to an annual subscription,INT-va1appin08-1452781380360-1825,Product or Service Quality issues,-0.0567156575217,Purchase Pricing Enquiry
i am looking to buy ts just wondering if it has guarantee,INT-va1appin10-1438006889913-77677,Ordering Process,-0.207455002277,Product or Service Details
there is a charge for 99 from amazon on my account ending in 098 that i didnt authorize,ID1183661314,Disputes,0.60671936971,Fraud
when is my next payment due and how much do i need to play to keep from signing off,ID666645315,Billing & Payments,1.09947692015,Billing & Payments
am i able to order online  sp to canada am i able to order and sp to us post office box is there an option to sp product to stores for pick up if product is not listed for sale in stores i will check thanks item says not sold in stores i guess not thanks,INT-sv1appin05-1445172086674-341,Shipping  & Order Status,0.65737649929,Shipping  & Order Status
vax impact plus reach bagless upright vacuum cleaner 3565456 ts item will not let me continue with colletion,INT-va1appin06-1437386628134-34343,Product or Service Details,0.384354356404,Product or Service Details
 i am interested in a washer-dryer do you offer installation and removal of old macne,INT-va1appin08-1437398704930-35070,"Discounts, Offers, Promotions",-0.246940234234,Shipping  & Order Status
i am having problems with my boiler the pilot light willl not stay on  we are not existing customers and wondered whether we could book an engineer today please,INT-sv1appin06-1453024686217-216113,Scheduling Appointments,1.13023073134,Product or Service Quality issues
 rozanne quick question where do i add the 10 code at checkout great thank you great - found it thank you,INT-sv1appin05-1445175507057-406,"Discounts, Offers, Promotions",-0.135965918547,"Discounts, Offers, Promotions"
yes id like to know the status of a payment i made a few days ago reference number11821 when and where the payment will be mailed,ID1205909374,Billing & Payments,1.54376262263,Billing & Payments
looking for new penton but those wardrobes are out from stock ,INT-va1appin06-1437384778898-34264,Product or Service Details,0.92187083323,Product or Service Details
i instruct you to stop sending emails about my forthcoming bill  i am more than happy to wait a day or so for my paper copy  i do not want my privacy otherwise invaded,INT-va1appin10-1452768841512-1235,Billing & Payments,-0.185625579931,Complaints
how can i find my complete card number onlinemy name is bridgette,ID670322978,Account Management,0.225595518493,Account Management
could you close my account and send me a check for the remaining balance please,ID1183300326,Account Management,-0.22072107361,Account Management
i want to cancel ts automatic spment how can i do that yes here is the subscription  subscription  8246801 e-mail addres xxxxxxx thanks,INT-sv1appin07-1445199054922-1017,"Modifications, Cancellation and Refunds",0.154824028357,"Modifications, Cancellation and Refunds"
when is my payment due of my balance,ID665286668,Billing & Payments,1.62811461473,Billing & Payments
"on my ciiti payments citibank on line screen there is a payment to ""search"" made on 232013 for 14058  who or what is search",ID1102043084,Billing & Payments,1.47044192971,Fraud
i went on a trip thurs 327 and at the airport on 327 i purchased a coke and bag of granola and the bill was 670 but the caser had trouble and in turn charged me 6070 -,ID1095931451,Product or Service Quality issues,-0.283905567308,Fees and charges
 for the past few months i have to tried to look how much of a credit refund i could get from my gas account but every time i have it i have had a message saying ts service is temporarily down,INT-sv1appin09-1452882405266-204724,"Modifications, Cancellation and Refunds",0.355583815937,"Modifications, Cancellation and Refunds"
we already have a contract with you for 108 tuttles lane west wymondham norfolk nr18 0dz tenated property we live next door semi-detached is ts the best offer available roger amp june meadows,INT-sv1appin05-1453218697472-234888,"Discounts, Offers, Promotions",-0.0911228908395,"Discounts, Offers, Promotions"
how do i stop ts obnoxious chat window from opening automatically every time i breathe,ID1206728207,Account Management,-0.331675804232,Account Management
i would like to stop schedule my payments and to get refund you charged my checking account on 827 and 926,ID670136437,"Modifications, Cancellation and Refunds",0.21335743736,Billing & Payments
i reserved a vax ultra + carpet cleaner for pick up from hailsham i now know i may not pick up until wednesday will hailsham keep it till then,INT-va1appin06-1437403841409-35643,Product or Service Details,-0.321062815139,Ordering Process
it wont let me sign up for boiler cover,INT-sv1appin08-1453230111956-236638,Purchase Pricing Enquiry,-0.239761094799,Purchase Pricing Enquiry
can i have a gift registry order spped to me rather than the registry recipient ok ill try that thanks ok tnk im all set thank you,INT-sv1appin07-1445203666655-1135,Shipping  & Order Status,0.682248413159,Shipping  & Order Status
we have homecare and i want to register my nectar card but i dont know if we already have an account set up with  _end_ hawthorne cottage the street upper farringdon gu34 3 _end_ sarah tabner 1169 sarahtabnermecom but it could be under my husband gary tabner 1860 gtabneraxiomcontractorscoukgarytabnermecom,INT-sv1appin10-1452534371294-167424,"Discounts, Offers, Promotions",1.23825192303,"Discounts, Offers, Promotions"
thanks i need assistant with an unauthorized debit for my checking account from a wle ago it was listed 3-29-2013 03-29-2013debit purchase mar 26 8351 delta duty free miami total of 40 x 3 = 120 was taken out  wle it should have only been 40,ID1102007195,Account Management,0.152934946698,Fraud
the letter says i have 85003 miles in my account,INT-va1appin05-1437164340248-23426,"Discounts, Offers, Promotions",0.215420420133,"Discounts, Offers, Promotions"
i would like to make credit card payment,INT-va1appin07-1437232330987-26618,Billing & Payments,0.640374042056,Billing & Payments
850034263374 hu there we have moved supplier and have a credit with you on our gas but a debit on electricity can you net one of the other and send a refund,INT-sv1appin10-1453205854965-233381,"Modifications, Cancellation and Refunds",1.19742540686,"Modifications, Cancellation and Refunds"
but i have money in my saving why dont i receive reminder for the low balance i am totally unsatisfied for the double deduction on my account and no reminder,ID1096297464,Billing & Payments,0.105591430069,Fees and charges
ill email my query  and complaint to british gas  no reflection on you,INT-va1appin07-1452774578885-1112,Disputes,-0.4715092338,Complaints
i was wondering if at all possible i could get some fees reversed pleaseim doing good thanks,ID669602430,"Modifications, Cancellation and Refunds",-0.21278788866,Disputes
 i want to pay my checking plus account but with a non-citibank account,ID1187408803,Billing & Payments,0.310412613629,Billing & Payments
wha are the current cd rates i have  a money market account with citibank gary,ID1206553500,Billing & Payments,-0.363825294845,Account Management
its shelley -are redeemable miles different with a venture card - how many miles do i need for a rt for ,ID635483856,"Discounts, Offers, Promotions",0.789486631152,Warranty & Repairs
i need my home care number,INT-sv1appin08-1452703835988-188123,Purchase Pricing Enquiry,-0.228719212079,Account Management
i was wondering if you could wave the yearly fee for the cc that i have  i have not used it in forever and would appreciate if i didnt have to pay the 39,INT-va1appin05-1437138600730-20774,Fees and charges,-0.404133694029,Fees and charges
 i need a 1099 how do i retrive it,INT-va1appin09-1437610383434-54609,Account Management,0.0356356250896,Disputes
 tommy i called the bank some days ago because of a recurring monthly service fee that i dont agree with,ID1103900762,Fees and charges,0.0785612116552,Fees and charges
 called you today about blocked drain,INT-sv1appin08-1452702203699-187857,Fraud,-0.690019982299,Scheduling Appointments
last time i chatted with an operator i asked m to set my account so i can get alerts not to miss my payment deadline,ID613796245,Warranty & Repairs,0.508211024692,Warranty & Repairs
i was hoping to get the dispute form faxed to me,INT-va1appin07-1438002204012-77312,Disputes,2.08105724305,Disputes
 i need to know how many reward points i have on my checking account,INT-sv1appin06-1436892475371-69144,"Discounts, Offers, Promotions",0.961712296433,"Discounts, Offers, Promotions"
i am losing money and my phone is not working,ID1020092179,Product or Service Quality issues,0.962188894332,Product or Service Quality issues
ihad a new boiler installed about 6 months ago and was told that i wont have to pay for homecare for a year but it seems that i am still paying for the care,INT-sv1appin10-1453200044928-232947,Purchase Pricing Enquiry,0.50822482673,Purchase Pricing Enquiry
on 717 was charged ooverdraft i covered it same day any way refunding pls,INT-sv1appin06-1438294787764-99201,Fees and charges,-0.219109973323,"Modifications, Cancellation and Refunds"
 i have got several items in my trolley and i want to reserve and collect them all together at the purley way extra store is that possible,INT-va1appin06-1438015103140-78409,Ordering Process,-0.303957699389,Ordering Process
 leo  i have a duplicate charge on my account in the amount of 541 from a store called just a buck up in poughkeepsie ny  the caser was having trouble with their credit card macne and i essentially was charged twice i chatted with someone here the other day regarding ts issue and she said to wait 4 days to see what happens  its been 4 days and i still see the charge on my account,ID1104906435,Fees and charges,-0.130644324924,Fraud
id like to update my address,INT-va1appin10-1437741055423-64987,Account Management,0.694611755661,Account Management
please could you tell me why i am no longer able to come to refunds online i have been having trouble with ts for a wle now,INT-sv1appin07-1453049637142-217669,"Modifications, Cancellation and Refunds",0.4637803206,"Modifications, Cancellation and Refunds"
i have an unauthorized transaction on my account  ref no,ID618042008,Disputes,0.0509236854776,Disputes
does it have electric rings as well or is it just an oven,INT-va1appin07-1437381754875-34120,Product or Service Details,0.399056180669,Product or Service Details
 kane - i need help with ts checking account i need to close it it hasnt helped me in any way and simply costs me money,ID1206485708,Account Management,0.0524496039379,Account Management
 dave -- my att mobility payment has not gone through electronically over the past 2 cycles and i just had to pay it with their collection folks,ID1203731145,Billing & Payments,0.618651378241,Billing & Payments
can you make deposits with citi mobile,ID1097776101,Billing & Payments,-0.225372896407,Billing & Payments
i want to cancel the payment insurance feature on ts account,ID658488611,Billing & Payments,0.0165664832121,Warranty & Repairs
i was wondering why i wasnt issued thankyou points for checking ending in 7867,ID1097002072,"Discounts, Offers, Promotions",1.33652156659,"Discounts, Offers, Promotions"
i would like to update the address associated with my account,INT-va1appin08-1437748608499-65624,Account Management,1.06157492814,Account Management
i am registered with online account but my email address is no longer valid as i used my old work email when i set up online registration how do i change to my current email address,INT-sv1appin06-1453197274448-232765,Account Management,1.32035276245,Account Management
i am trying to redeem travel jet blue april for + wch bought tix wch were each about + but lumped together on the bill- how do i do ts,ID613770264,"Discounts, Offers, Promotions",0.240736268596,Warranty & Repairs
 i just wanted some details regarding ts offer you have sale on boilers,INT-va1appin06-1452766501087-1169,"Discounts, Offers, Promotions",0.570386577925,"Discounts, Offers, Promotions"
my wife is american citizen and opened a checking account in usa by phone when we arrived here as i have a permanent inmigrant status i could not share that account until receiving my green card and ss number i now have both of them what should we do to incorporate me to that checking account and have access to citibank usa online and usa debit card,ID1101103501,Account Management,1.02122796333,Account Management
" alex i was wondering if there was any way to change the person who will be picking up my store pickup order it tells me that i have no recent orders ""invalid activity token """"xxxx-xxxx-0071"""""" i need to add them to an order i placed a few days ago ""when i made the order i submitted their name and email but i guess it didnt update or sometng because t were turned away"" ""okay so ill have to wait for a refund and then try again""",INT-sv1appin07-1445176116176-420,Shipping  & Order Status,0.100488895045,Shipping  & Order Status
i would like to buy ts fridge freezer with my argos card,INT-va1appin09-1437486416276-42941,Product or Service Details,-0.26249350478,Ordering Process
i am disputing several transactions and its saying more information is needed can you please give me more information,INT-sv1appin05-1438106418511-84994,Disputes,0.842138547913,Disputes
 brain i received mail stating i missed one of my cap one credit steps and thats not true and i want to find out why,ID661077042,Disputes,0.0220684274684,Disputes
how do i add a payee in my online payment account,INT-va1appin10-1437322031093-30568,Billing & Payments,1.09057862686,Billing & Payments
but it still shows as being in credit should i request a credit refund and carry on with the pound40 or leave it as is,INT-sv1appin06-1452704932480-188315,"Modifications, Cancellation and Refunds",0.937888102686,"Modifications, Cancellation and Refunds"
kevin - it seems citi transferred the identical payment 2 days in a row from my checking account to my citi credit card account i do not need that payment to be duplicated there must be an error somewhere,ID1206420422,Billing & Payments,0.238723320537,Fees and charges
i would like to gather some information on closing my account i dont want to close it right now as  i still have ongoing business on it but i would like to close it next month all good in australia ,ID1187477148,Account Management,1.05320061085,Account Management
john winwright 29 angus close banbury ox161 _end_ i am with scottish power and looking at if you can save me  _end_ i have and you are ,INT-va1appin10-1453819057379-53976,"Modifications, Cancellation and Refunds",-0.00317725324931,"Modifications, Cancellation and Refunds"
my husband has a personal citibank account and i want to set up s account in our joint account so that i can transfer cash immediately to s personal account is that possible,ID1207150837,Account Management,0.67692817065,Account Management
karen carter 135 upper station camp ck rd gallatin tn 37066 xxxx-xxxx-80658 is the order no did it go thru or not email xxxxxxx it was a day only 15 percent offf it has not processed thru my credit card that just great,INT-va1appin09-1445110887114-23941,Shipping  & Order Status,-0.365694891086,Shipping  & Order Status
i thought i had put an order in for these pajamas last weekend and was wondering if i did it right dawn trimboli xxxxxxx was the order sent in and when will the items arrive thank you nash for your time have a great day i did recieve the order xxxx-xxxx-4326 i also ordered 3 pairs of pajamas for boys the same day and would like to know if that order went through and when i would recieve the merchandisw,INT-va1appin09-1445113463071-24217,Shipping  & Order Status,1.06947781819,Shipping  & Order Status
i sent ts payment in error can you please cancel it without a penalty,INT-va1appin06-1437433215948-39283,Billing & Payments,0.941701884339,Billing & Payments
"i was given a friends and family completion coupon for a baby registry but it is not taking it any reason why i checked with the registrant and it appears to be the same code is that why if its already been used by her how do i obtain a valid 15 off coupon so i can purchase sometng off the registry its not for the registrant and friends and family ""i received the friends and family email but it appears to be the same code she has is it a different code"" sdxfdmchx7mrgde",INT-sv1appin05-1445194094575-883,"Discounts, Offers, Promotions",0.367044721531,"Discounts, Offers, Promotions"
we made a 500 online payment to united airlines on august 22 to renew our membersp in the united club  united has no record of the payment  what evidence can we supply united of the online payment,ID1191843811,Billing & Payments,1.22633727414,Billing & Payments
looking for a credit of 7900 from a ckmpany called cold steel  has it been posted fredrick h cross,ID1205996309,Scheduling Appointments,-0.356992511118,"Modifications, Cancellation and Refunds"
 my name is elena loredana ciobanita and i would like to have the bill gas on my name if possible please,INT-sv1appin06-1452616203821-177643,Billing & Payments,-0.619848309372,Account Management
i put in all my card info and email address correctly and when i push complete order it kicks me back to the email and security number on the back of my card  i enter it again and it does the same tng thank you im not sure i know what you mean by different browser ok thank you anyway i really need ts item as i cannot find it anywhere just wish i could order it from here i found the number what next xxxx-xxxx-7170,INT-va1appin09-1445125641992-25366,Website Issue,-0.209309965697,Website Issue
i have a charge on my account that i did not make,ID663202811,Fees and charges,-0.0270239409036,Disputes
bosh wasng macnes grapte,INT-va1appin09-1437736218074-64729,Product or Service Details,0.729597277461,Product or Service Details
 there i dont need a repair done on my boiler but we would like to have cover for the future and also have it serviced what would that cost,INT-sv1appin10-1453201390151-233051,Purchase Pricing Enquiry,-0.328629134934,Purchase Pricing Enquiry
i was trying to login to my citi credit card account and it kept taking me to my citi bank account i linked the them together and it said t are now linked but i do not see my credit card info on my bank account page what am i missing,ID1208679783,Account Management,0.819829353067,Account Management
"i keep getting an error saying ""oops an exception has occurred"" after i enter my pin and try to complete my order ""i tried going back out and back in yes i am logged in"" where do i go to delete cookies firefox ok thanks",INT-va1appin10-1445037641906-18669,Website Issue,0.29361899378,Website Issue
there are three items in my shopping basket wch i want to pay for but your site keeps referring me to carry on searcng - why dont you want me to buy anytng,INT-va1appin07-1438013067060-78236,Shipping  & Order Status,-0.475462501067,Website Issue
 i heard that tomorrow target will start worldwide spping is that true ok well thats nice to say from target,INT-sv1appin10-1445181754042-547,Shipping  & Order Status,-0.00436001226797,Shipping  & Order Status
i am looking to upgrade my account to homecare 4 and note the charge will be 1750 per month but i am already paying 1940 per month for central heating only,INT-sv1appin07-1452076828762-120591,Purchase Pricing Enquiry,-0.532902034361,Purchase Pricing Enquiry
 kenneth there is a pending incorrect charge on my debit card 06-20-2014debit authorization jun20 0351p 2429at 1551 aloft silicon vall newark  3597 can ts please be reversed asap,ID1144318670,Fees and charges,0.0779396089732,"Modifications, Cancellation and Refunds"
the pages need a new id and password why,INT-va1appin10-1437842566489-70484,Account Management,0.380753256494,Account Management
i was looking at beds and fitted war drobes yesterdday i got to check out to find part of the furniture out of stock can you tell me when t will be in stch,INT-va1appin05-1437404926516-35770,Product or Service Details,0.0134955366005,Product or Service Details
i am trying to a repair and homecare 200 cover online but it does not seem to be working,INT-sv1appin05-1453104192611-223407,Purchase Pricing Enquiry,-0.331130889363,Purchase Pricing Enquiry
carolyn is on the accountthere are four charges on my account from sixfigure thos e were just supposed to be just one and refunded on sept 15,ID661774735,"Modifications, Cancellation and Refunds",0.103722694159,Disputes
ya weve just recently moved into a new home the week before christmas and i keep receiving bills from you asking for money as soon as we moved in we switched supplier,INT-va1appin07-1452759979882-793,Account Management,-0.341947833603,Disputes
looking for payment to coast electric in july,INT-sv1appin09-1438352779795-102433,Billing & Payments,0.731424457705,Billing & Payments
i sent a payment through our bank  last week i just checked and it shows it was processed and the money was taken out of our account but you still show it past due why,ID668842978,Billing & Payments,-0.193645198231,Billing & Payments
 i have a dispute with a payee about a payment 08-25-2014 oconnor and associates aug 24 0854 3659reference 10051 - 17720,ID1187274739,Disputes,0.630582291491,Fraud
is the chat log sometng you can access oh okay he was helping me close my account he needed to check that my address was correct to send the check for my savings account balance,ID1188898832,Account Management,0.787495668343,Account Management
